Name,Price,Stars
"365 Everyday Value, Whey Protein Powder, Natural Chocolate Flavor, 16.1 oz",13.99,5 o
"Optimum Nutrition Gold Standard 100% Whey Protein Powder, Double Rich Chocolate...",54.06,4.4
"BSN SYNTHA-6 Whey Protein Powder, Micellar Casein, Milk Protein Isolate Powder, Chocolate Milkshake, 48 Servings",40.45,4.6
"MusclePharm Combat Protein Powder - Essential blend of Whey, Isolate, Casein and Egg Protein with BCAA's and Glutamine for Recovery, Vanilla, 4 Pound",31.25,4.3
"Optimum Nutrition Gold Standard 100% Whey Protein Powder, Double Rich Chocolate...",26.96,4.2
"Premier Protein 30g Protein Shake, Caramel, 12 Count",15.83,4.3
"Body Fortress Super Advanced Whey Protein, Cookies N' Creme Protein Supplement Powder to Build Lean Muscle & Strength 1-2lb Jar.",16.13,4.1
"Isopure Zero Carb Protein Powder, 100% Whey Protein Isolate, Flavor: Creamy Vanilla, 3 Pounds (Packaging May Vary)",37.99,4 o
Nutricost Whey Protein Isolate (Unflavored) 5LBS,45.95,4.3
"MuscleTech Phase8 Protein Powder, Sustained Release 8-Hour Protein Shake, Milk Chocolate, 4.6 Pounds (2.09kg)",30.63,4.3
"Orgain Organic Plant Based Protein Powder, Creamy Chocolate Fudge, 2.03 Pound, Packaging May Vary",21.09,4 o
"Dymatize ISO 100 Whey Protein Powder Isolate, Chocolate Peanut Butter, 1.6...",28.49,4.4
"BPI Sports Best Protein Advanced 100% Protein Formula, Vanilla Swirl, 5 Pound",42.00,3.7
"PBfit All-Natural Peanut Butter Powder, 30 Ounce, Peanut Butter Powder from Real Roasted Pressed Peanuts, Good Source of Protein, Natural Ingredients",16.47,4.7
"RXBAR Whole Food Protein Bar, Chocolate Sea Salt, 1.83 Ounce (Pack of 12)",20.39,4.1
